{
  "schemaVersion": "1.0.0",
  "configurationVersion": 1,
  "cameraExternalId": "ppe-demo",
  "regions": [
    {
      "regionId": "f81d4fae-7dec-11d0-a765-00a0c91e6bf6",
      "geometryVersion": 1,
      "coordinateSpace": "NORMALIZED_0_1",
      "polygon": {
        "coordinates": [[0.001, 0.001], [0.999, 0.001], [0.999, 0.999], [0.001, 0.999]]
      }
    }
  ]
}
